_c0,score,controversiality,body,timestamp,sentiment
1293883,123.0,0,You really clarified the problem with bitcoin though its an asset not a currency. The value is simply too volatile to serve its intended purpose well so its become a bubble like pogs.,2016-12-25T15:25:06.000Z,0.25
1293884,36.0,0,Putting  of your savings in any single investment is a bad idea.  The key to intelligent savings is to diversify your investments across different vehicles.  Nothing is without risk including Bitcoin so you shouldnt put all your savings in that single investment vehicle,2016-12-26T14:41:32.000Z,0.25
1293885,22.0,0,Indeed thats true. There are scammers who just fork bitcoins source code and pay for media exposure to pump their schemes.  In contrast monero is not a clone but a complete redesign of the concept of bitcoin with several improvements.  The community is quite good at rmonero if you have any questions after your research.,2016-12-08T16:52:45.000Z,0.25
1293886,19.0,0,gt Since the breakdown of the alternate clients XT and Classic Unlimited became the place to go for deviant developers and attracted inter alia Tom Zander and Tom Harding.  Thats news to me.  Im taking issue with the word breakdown. I dont think thats appropriate. It sounds rather fatal.  BU has been working on one problem that Bitcoin has Classic has been working on several other problems. Working together doesnt mean Im attracted to BU. It means we are working together.  endrant.,2016-12-03T22:49:13.000Z,0.25
1293887,20.0,0,Thinking about writing up a guide to local Bitcoin. Thoughts?,2016-12-09T13:10:48.000Z,0.5
1293888,37.0,0,why do people say this?   here are bitcoin returns by year     starting in july .   .   .   .   .   .   .   That is beyond outstanding.,2016-12-12T16:00:42.000Z,0.5
1293889,-4.0,0,They brought so many users in bitcoin but they didnt care to  improve the underlying technology with their immense resources? Contributing to the underlying software is something every big bitcoin company should do provided that they respect their investments. This is exactly how the Linux kernel development works.,2016-12-08T17:52:18.000Z,0.25
1293890,20.0,0,If by vandal you mean someone that disagrees strongly with Greg trying to hold back bitcoin scaling and talking about it online sure whatever you say.,2016-12-30T03:31:31.000Z,0.25
1293891,18.0,0,Hash power if a miner decides to mine a bigger block. Which would be a bit silly  but thats how bitcoin works.,2016-12-18T14:57:23.000Z,0.5
1293892,15.0,0,Why are big blocks such a taboo thing nowadays? If Gavin Andresen were still in charge of Bitcoin wed have done BIP and there would be no drama aside from paranoid outbursts from small blocker extremists about how big blocks in datacenters will lead to a reptillian takeover of Bitcoin.  Laughably even if big blocks in datacenters led to an unimaginably contrived global governance takeover of bitcoin that coin in that state would be much more widely accepted and traded than the bitcoin we have today. The mining ecosystem would be stronger and more diverse. Satoshi probably realized this which is why his initial inclination was to scale Bitcoin in datacenters with big blocks.  But I almost forgot Blockstream wouldnt get paid millions in consulting for sidechains that way and Gentoo Linux desktop loving C programmers would have to run ghastly servers costing hundreds and hundreds of dollars. Oh me oh my.,2016-12-11T21:08:02.000Z,0.25
1293893,14.0,0,Do you know what keeps bitcoin going? Where does the value come from and how it will disappear? How exactly will it be stomped out? Lets be specific here ok?,2016-12-25T17:06:01.000Z,0.25
1293894,21.0,0,Putting  of your net worth while still highly risky and dangerous actually doesnt even strike me as horribly stupid. Even if the price crashed to  you have only lost half of your net worth and the price is lower and you could feel more confident slowly accumulating again.   The part that shows a gambling addiction as opposed to a desire to make money is the part where you take that bitcoin and use it as leverage for a futures position. This is your mind chasing emotional highs and lows. Thats what a lot of people dont understand about gambling addiction is that the gamblers are as addicted to the lows as they are to the highs. Both make them feel alive. If it wasnt for the potential of losing all your money in a  downward move there would be no appeal to you because it wouldnt be risky enough.  Do whatever you want but just dont try to say you are doing it because you dont want to miss out and fuck fiat. You are doing this for a gamblers rush pure and simple. Putting all your money in bitcoin is more than enough to not miss out and stick it to our fiat overlords. Taking that money and gambling on okcasino is an entirely different thing and is purely gambling addiction.  The saddest part is that if you do happen to buy on futures at a good time and make a significant chunk of money it will only encourage your bad decision making and whatever profits you make will be surely lost down the road making a similarly bad decision.    Good luck bud.,2016-12-22T20:33:14.000Z,0.25
1293895,27.0,0,Whenever bitcoin would massively shit the bed which is to say a few times a year you would always see some dude going no no no guys its actually a good thing that the market crashed because  Its very similar to the way that goober is saying no no no guys its good for the cause that some crazy with an assault rifle showed up!,2016-12-05T08:17:58.000Z,0.25
1293896,-7.0,0,There are more than  crypto currencies right now.  Just like beanie babies whichever is popular at the time gets the money.  Everyone who owns it sells it like a gold mine because others buying in to it have a self interest in making the price rise as they build interest in it.  True if bitcoin is the one that succeeds it stands to make you a lot of money. But its all fake and based on what people will pay for it.  Just like beanie babies which had the market capped and now are just another worthless toy.  Be careful.  Invest what you dont care to lose or just put that  on black and see what happens if your looking for instant gratification.,2016-12-27T23:55:54.000Z,0.25
1293897,28.0,0,Need money for bitcoin for alcohol,2016-12-29T21:15:22.000Z,0.5
1293898,-15.0,0,If you dont mind taking risks you could invest in Bitcoin and hope your money grows. Compared to last year the price of BTC is up  USD. You would just have to deal with the learning curve. But if you want minimal risks then its not for you.,2016-12-26T07:12:01.000Z,0.25
1293899,15.0,0,gt  bitcoin not useable much for payments at scale  No. It doesnt.  It means not compromising security and monetary soundness in order to try to compete directly with paypal and visa at all costs.  The end result of trying push in more capacity will actually compromise Bitcoins ability to be useful for payments because if the network is not very secure and stable it cannot underlie secure high volume payment mechanisms. an N megabyte block where N is even remotely plausible from an engineering perspective gets nowhere near the kinds of volumes needed for broad worldwide adoption without using scaling mechanisms.,2016-12-02T13:51:44.000Z,0.25
1293900,-8.0,0,What has this got to do with bitcoin?,2016-12-31T04:35:05.000Z,0.5
1293901,67.0,0,Can we stop with the us vs them attitude?  We are all bitcoin users regardless of the client we use.,2016-12-29T15:31:23.000Z,0.25
1293902,-6.0,0,Hold up youre saying you dropped almost .k on btc during finals week? Im sorry but I call bull. No one throws .k at while I actually live off bitcoin what is essentially in investment without knowing more about it.,2016-12-11T18:40:11.000Z,0.25
1293903,29.0,0,I think this a good thing. Keep Bitcoin on its toes and force it to compete with other currencies rather than sit high and mighty on its first mover advantage. If its truly best let it win in fair competition amongst the rest.,2016-12-24T20:45:27.000Z,0.5
1293904,86.0,0,Otherwise it would give the impression that a select small group of developers with high Blockstream elements sets the direction and agenda how Bitcoin evolves.  developers sounds more consensus more decentralized and it sells better to the public.,2016-12-09T21:12:26.000Z,0.25
1293905,23.0,0,To put this in perspective around ten years ago Bitcoin was so worthless someone traded s of them for two pizzas.,2016-12-25T17:22:08.000Z,0.25
1293906,18.0,0,Well the cool difference is that once you give your money over and get the bitcoin  as long as you have the private key  youre in total control of the coins.,2016-12-25T17:56:43.000Z,0.25
1293907,16.0,0,Im an average person and I use Bitcoin to feed families I know in Venezuela. Bitcoin is  the absolute best way to get money to them bypassing all the governments currency controls and faux exchange rates.,2016-12-25T16:48:04.000Z,0.5
1293908,102.0,0,This is good for bitcoin.,2016-12-05T00:26:57.000Z,0.75
1293909,22.0,0,Depends on if you believe in Bitcoins long term success and youre able to hold despite short term volatility without panic selling.  And as per usual  Rule   Dont invest more than you can afford to lose.,2016-12-18T04:27:43.000Z,0.25
1293910,16.0,0,gtThe article by Huang Shiliang attempts to dissuade people from adopting SegWit in order to delay the deployment of Lightning but not deploying SegWit would only result in a weaker Bitcoin network now and slightly delay Lightning potentially giving other blockchains an advantage because they can deploy Lightning. So I can confidently say that not deploying SegWit for the sake of delaying Lightning is a mistake. In fact there is no reason to delay Lightning in the first place it is a complementary technology to the main Bitcoin network and furthers Bitcoins reach into a number of usecases that were so far unreachable.  Christian Decker  Should be clear by this point that Huang Shiliang is not a friend of bitcoin.   I hope Christians response to his article was translated into Chinese and circulated on btc.com!,2016-12-26T09:38:27.000Z,0.25
1293911,-4.0,0,This subreddit obsessed with the Austrian economics cult believes by handing trillions of dollars in interest payments to idle bondholders it will improve the economy.  They also believe in money that should be artificially kept scarce and hoarded by the same tiny elite.  Its incredible to me how a subreddit entirely comprised of poor people with meager shavings has internalized the commands of their oppressors to such a point.  Like the fed just raised interest rates by  but the media reports it as by . because its a smaller number. Going from . to . is an increase of .   If you are a bondholder with billions you just received an income boost if you are someone in this subreddit with  in your bank account your monthly mortgage just spiked.   Lets all cheer and give more of our income to bitcoin early adopters and Asian miners to save our value!,2016-12-14T21:06:27.000Z,0.25
1293912,14.0,0,He need to have Bitcoin crippled in order for Blockstream to keep their investors happy and maybe even get more investments.,2016-12-17T11:11:51.000Z,0.25
1293913,20.0,0,Well lets look at the figures then.   In the few months since CoreBlockstreams plan for full blocks has started to take effect in the mildest way they are already down to about  of the hashrate and node count despite having every conceivable advantage historical Satoshi repo a powerful technical team with  developers built up trust from the Gavin years  million in venture capital inertia user laziness minernode fear of unknown dev teams and the most viciously proCore censorship campaign hello echo chamber! on theymoscontrolled platforms with the most valuable namespace on reddit  complete with these platforms own historical inertia.   Patiently waiting for  community consensus...while Greg is one of the most prolific posters on this sub. Segwit is CoreBlockstreams key move and miners are pissing all over it. This is nothing less than a vote of no confidence in Core dev from the miners the real stewards of the network that Core only pretends to be.  gtYou guys seek to do harm to bitcoin with a contentious   Forks all the solution to contention. Meanwhile Core stubbornly tries to enforce a contentious stasis. In fact you mention market price seemingly unable to understand that the only way to get a market price comparison is to hard fork and let the two sides trade against each other.,2016-12-09T18:03:35.000Z,0.25
1293914,21.0,0,I have considered Bitcoin Talk to be hostile territory for over a year. Its a cesspool of scamming and hate where any attempt to conduct honest business is met with suspicion and any attempt to conduct a scam is welcomed with open arms.,2016-12-27T15:50:05.000Z,0.0
1293915,21.0,0,Adam and Greg know their days are numbered and they will soon be ejected from the bitcoin project.... This is a pathetic attempt to change history by refusing to acknowledge satoshi nakamoto and trying to pass themselves off as important contributors to bitcoins infancy for future generations,2016-12-29T18:04:46.000Z,0.25
1293916,31.0,0,This question has been asked many times and no one can give a clear answer all propagandaadvertisement  In fact no one can give a convincing answer that why should we fix transaction malleability. It was not fixed and did not affect anything during past  years. TXID is only an indicative index all the serious programmers check the inputoutput not TXID  From code level you could say that segwit is motivated by the ugly way that op_checksig constructs but that ugly construction does not really matter it still works it is just programmers habit to fix things and make them looks nicer. But the segwit fix itself just made bitcoin much less nicer much worse than the inperfection in op_checksig  And that excuse for LN is even more absurd I have explained in order to dramatically grow bitcoins exchange rate we should try our best to avoid offchain transactions like LN or exchange internal transactions since they reduce the money demand the effect is similar to QE  ELI Why lightning network payment channel will reduce bitcoins value,2016-12-15T02:25:00.000Z,0.0
1293917,41.0,0,Point and Figure Chart  Happy New Year to everyone.  Yesterday the long pole resolved into a column of Os.  It dropped to  and had a pretty good bounce.  I thought the drop was finished but evidently China thought we needed to go back down.  So overnight we hit the  price point.  A proper correction from a long pole is half of the length of the pole.  Because the pole was  rows high the drop down could be between  and  boxes.  Thats one more box down on the drop.    Soif you are shorting we may have another  from the overnight low.  Going lower than that could be problematic for the longs.  Here is why  If there are a lot of leveraged longs coming in from the past break out at  they are going to start going into the red.  And margin calls are going to start coming in.  On top of that the traders are going to see we are not hitting the ATH on this trip and they will start to bail out.  If we go into the s the resistance drops down to the  range.  I am not sure of the Yuan price in that rangebut people trading in Yuan dont like to lose money either.  I am cautiously optimistic.  The trend is up.  We are still up based on the chartmeaning that the short term movement is up and the long term movement is up.  I think going into this weekend we wont see Dow .  The PBOC could devalue again and hit the scary  ratio of YuanDollar.  The Italian banks would go belly up.  Or nothing could happen.  The GOOD thing about bitcoin is that its a  hour market so you CAN bail on a long weekend.  So here are the new numbers  Moving up to  or more means a reversal into a column of Xs up. The Negative break down is at .  I dont think thats in play at this time. The overall trend reversal happens down at .  My guess is that it reverses above  at some point today.  But that we just bounce around waiting for something to push it from the outside.  Enjoy your long weekend and I wish us all a Happy and Healthy New Year.     Charts of the Day,2016-12-30T13:05:19.000Z,0.25
1293918,25.0,0,So when do we move onto bitcoin?,2016-12-17T21:08:19.000Z,0.5
1293919,45.0,0,What a ride its been. Think of all the people who bashed Bitcoin when we were in the low s. Claiming there would be a slow and steady death. Friends and financial professionals looking at me like I was a complete idiot for putting money into Bitcoin.   Yea!? Well look at us now! Suck it long suck it hard haters!,2016-12-22T06:34:12.000Z,0.25
1293920,-4.0,0,I know exactly how counterproductive moderation dictatorships are.  Its that kind of behavior that has crippled Bitcoin and spawned Ethereum.   Oh I know exactly what Im doing.,2016-12-28T20:32:05.000Z,0.25
1293921,56.0,0,Hey Im looking for a developer to build my amazing idea! Now I cant tell you the details until you sign this NDA but its guaranteed to make millions. Imagine Bitcoin  Facebook  eBay but with a focus on family.  I cant pay you anything but can offer loads of equity which like I said will be worth billions soon because my idea is so brilliant.,2016-12-02T23:48:45.000Z,0.5
1293922,31.0,0,Its like Oprah  YOU GET A BEATING AND YOU GET A BEATING AND YOU GET A BEATING!  This is good for bitcoin,2016-12-03T00:22:59.000Z,0.25
1293923,-7.0,0,Youre too deep into it clearly. Bickering on this thread isnt going to help you. You should have diversified... even if you are long on it.   Why bring up Bilderberg? I rather have that than Satoshi and the Winklevii in control. You need to accept that Bitcoin is not as perfect as youd like it to be. The ownership share prevents it from ever becoming a widespread global currency. Its all being held on speculation not spent. We will have to move to Ethereum or Litecoin.  Decentralised currencies cant offer protection to the individual. You lose your private key and youre fucked. Central banks can print money to bail out banks and keep people from losing their homes. Im no lefty or even a centrist but I still find it astonishing that people genuinely believe Bitcoin WILL BE the currency of the future. No it wont. This will come to an end and well all look back on it thinking we were so stupid to invest so much into these crapcoins.,2016-12-31T18:24:41.000Z,0.25
1293924,20.0,0,The world has plenty of   Hightransaction payment networks   The world has never had a good   Store of value that is borderless  ...Until bitcoin. It really singes my hinges when people keep pushing for bitcoin to be their starbucks payment method at the risk of destroying bitcoins special abilities.  In the world of money bitcoins got Superpowers right now! But so many complainers just want it to be another paypal so badly that theyre quite willing to opt for a Hard Fork and risk those superpowers and bitcoins total value.,2016-12-12T17:44:05.000Z,0.25
1293925,-4.0,1,I dont think you get how this all works....  Without the miners there is no security. Also you can not simply abandon miners who dont agree with you.  The miners vote plain and simple  They vote with their hashpower.  Its often misrepresented here that somehow the miners would collude to do harm to the users in some way however the entire bitcoin system is designed around the game theory that the miners are incentivized to do whats in the best interest of protecting the value that they have mined.,2016-12-11T15:15:51.000Z,0.25
1293926,18.0,0,I fucked up my Bitcoin bet and forgot a zero after the decimal. Accidentally bet  of my bank on the Nets tonight. Finally something went right for me.     edit  shout out to the dude who had that sick nets writeup that talked me into the play.,2016-12-27T03:23:12.000Z,0.25
1293927,36.0,0,First of all note that Bitcoin Unlimited doesnt do anything to the consensus rules by itself. It instead lets the user set the blocksize settings. The user is free to set them to match Bitcoin Core settings in which case there is no difference from now. All BU does is make it easier for the user to change the settings without having to know how to code.   Thus BU is not fundamentally a bigger blocks implementation. Its a user control implementation. It simply recognizes that when Bitcoin is at trilliondollar market caps it will make no freaking sense to have consensus rules be tied to easily cooptable centralized development teams as all dev teams are. Instead coordination on consensus rules will have to happen in a decentralized fashion where each economically important node and miner makes an informed decision rather than trusting Papa Core.  If people think this will lead to bigger blocks it can only be because the ecosystem of economically important nodes and miners want bigger blocks and believe there is no danger of centralization. You can thus see that Cores position is innately paternalistic thinking that the devs know best about how to design incentives and economic constraints. Realize that not a single one of the devs at Bitcoin Core nor to be fair any other team have demonstrated any expertise in incentive or economic design except Satoshi who is now gone.,2016-12-28T19:55:43.000Z,0.25
1293928,14.0,0,Good old german engineering masterpiece of bitcoin.de is working like charme for as long as im in the Business years. madeingermany,2016-12-23T09:51:51.000Z,0.5
1293929,26.0,0,Good stuff but anyone whos been doing engineering long enough knows he was _no ordinary man_. Dedication enough doesnt get you to Bitcoin.,2016-12-30T23:48:54.000Z,0.25
1293930,-10.0,0,Just switch to Bitcoin Ocho. MB Blocks NO ASIC. Bitcoin Ocho is the Future.   httpsbitcointalk.orgindex.php?topic.msgmsg,2016-12-17T01:35:00.000Z,0.25
1293931,-7.0,0,gt And MB full blocks at . each would still be far more in fees than there were on the network until very very recently.   But not as much as a fee market that we have now. Therefore your argument completely falls apart. Additionally  months in bitcoin time is not very very recently  gtYou are forgetting to take into account the increased value of the coin base reward due to the additional people using Bitcoin  We cannot make this assumption. The extra capacity could be quickly filled with a few business use cases and doesnt necessarily mean more consumer use . Additionally there is good evidence that the coinbase reward will drop after a hardfork as we have seen in the ETHETC split.,2016-12-13T13:56:17.000Z,0.25
1293932,26.0,0,We also saw this kind of desperation from CoreBlockstream before  gt The only reason were seeing this flurry of cutesy blocksize BIPs now BIP  linear?!?  bytes   min?!? is because Core devs are panicking Jan.   is around the corner and  of the network is quietly running BIP   XT and it can trigger any time thereafter once blocks get full.   themselves.,2016-12-04T20:32:01.000Z,0.25
1293933,20.0,0,gt This is simply untrue.  Heres whats true Circle specifically named the Core development team everyone.,2016-12-08T06:30:01.000Z,0.5
1293934,-5.0,1,Altcoins are inherently unethical because they are attempts to dilute Bitcoins fixed supply.  Yes people will mention some crap about new features and experimenting but its really about dilution and stealing wealth from bitcoiners.  Therefore it is time for us to celebrate the altcoins demise.,2016-12-06T15:28:30.000Z,0.0
1293935,21.0,0,digit bitcoin days are for the history books my friends.,2016-12-27T15:15:56.000Z,0.25
1293936,23.0,0,I bet this is going to be a trend. VC money flowing to Ethereum instead of Bitcoin.  Bitcoin cant scale sidechains hasnt happened Rootstock is paralysed and the infighting is an embarrassment.  I wonder how long it will be before we see more existing Bitcoin startups start to offer Ethereum support like Factom and Coinbase.,2016-12-10T20:01:52.000Z,0.25
