_c0,score,controversiality,body,timestamp,sentiment
1294180,63.0,0,The most dangerous content you can share on rBitcoin the idea about alternative Bitcoin clients. Supporting ignorance maintains power.  httpsyoutu.belMTgYss,2016-12-29T17:17:52.000Z,0.25
1294181,14.0,0,And people still wonder if BitcoinEthereumcryptocurrencies are gonna be the next BIG DEAL!,2016-12-01T05:09:54.000Z,0.25
1294182,17.0,0,gtI know there are flaws with bitcoin but this is minor.  I would say it is not minor.  gtI personally do not believe a traceable history will have a negative impact on price.  When it is more about practical use then pure speculation then yes it will have a negative impact on price.  Cryptocurrencies are still so small and have a lot of room to grow therefore I stick to XMR as I see here much more growth potential and it beeing underestimated. That is what you search for as an investor for underestimated but healthy projects.,2016-12-02T14:30:07.000Z,0.25
1294183,14.0,0,Well buy so many pins with our bitcoin earnings wont we folks?,2016-12-14T19:21:36.000Z,0.25
1294184,18.0,0,at this point Bitcoin is not looking too good    Well played Paul. Ability to understand the difference between short term and long term on full display there.  Or in musical form.. what a difference a day makes...,2016-12-28T13:07:15.000Z,0.25
1294185,15.0,0,Well as another fellow developer its kind of a silly statement to hear that its meant to be hidden. I mean theres multiple libraries that provide the API to quite trivially parse the GB of all on the BitCoin BlockChain. You know as much as I do its a mere few lines of code for extracting most of what matters.  My personal theory is that a DMS release would be very easy and obvious. There are no good reasons to obfuscate it. You want the content released. Especially since the BlockChain is censorproof theres hardly a good incentive for it to be obscure. I literally expect it to be in plain text and if theres complex encoding due to large file then the instructions will be provided in clear txt how to cobble up the parts together.  As far as DMS goes though if I were to make one Id probably make it using RAID pattern this way allowing for the signal to be reconstructable even if some DMS do not triggergets disabled. This has the side benefit of providing tripwires so to speak to avoid an accidental release and advance warning that things are amiss.,2016-12-08T07:04:50.000Z,0.25
1294186,48.0,0,This is the stupidest article Ive read in a while. They showcase Italy and Germany as big winners of adopting the Euro. Did anybody hear of Greece and Spain and Portugal and also Italy that have struggled to fire up their economy because they cant use monetary policy? The downfalls of the Euro have been studied far and wide in the past  years exactly because of reasons which are nowhere to be found in this article.  Im honestly pretty shocked that this journalist who appears to be in the senior journalists at CBC thinks that the Canadian dollar exists for sovereignty reasons and not for economic reasons.  Also love how hes referring to bitcoin at some point. Probably thinks to himself Im so up to date with things thinking that Bitcoin is going to take over the world someday. Jesus.,2016-12-11T18:23:35.000Z,0.25
1294187,-5.0,0,gtThis could also become more difficult as recent media reports say there are signs that the authorities are curbing gold imports and could start cracking down on bitcoin related capital outflows.  Worst news ever! Dump you fools!!,2016-12-19T01:12:44.000Z,0.25
1294188,-7.0,0,Developers work on what we want to work on or what were paid to work on. Quite often that is what we think is in the best interests of Bitcoin. But we are not representatives nor accountable to random users. Users represent themselves by choosing to run or not run software we produce and sometimes by paying or convincing a developer to work on something that interests them.,2016-12-19T12:38:39.000Z,0.25
1294189,-8.0,1,Huh? This doesnt obsolete segwit or Lightning at all.  Unless Im missing something Teechan is an effectivelycentralised offchain system. The argument for tolerating it is that everyone trusts AMD andor Intel already. This mandatory trust is itself a threat to Bitcoin.  Not to mention even if segwit and Lightning were rendered obsolete that would be good news for Blockstream.,2016-12-23T05:03:32.000Z,0.25
1294190,16.0,0,Am I the only one who sees Circle and Coinbase collapsing good news for bitcoin? These two companies have got no stakes in bitcoin got in when bitcoin was small with really huge amount of monies. Then they went on a spending spree.  Circle got m in funding to create a bitcoin wallet with credit card purchase. Now that they disabled credit card purchase they are basically an online bitcoin wallet.  They have a nice interface but thats really about it. Coinbase has a nice interface too but it did come with BUGS and also a poor customer service. But for less capital than circle at least they created an exchange merchant service multisig wallets etc... Makes you wonder where the m really went into.  These companies especially circle are toxic. They are a massive failure. And just like toxic people having them in your life is negative and can affect you. We better split ways from these guys very soon.,2016-12-07T12:05:47.000Z,0.25
1294191,-16.0,0,Not a millennial Im a gen x. But I keep my money on the Bitcoin blockchain. Millennials laugh at me. I smile back.,2016-12-01T03:45:39.000Z,0.25
1294192,-14.0,0,Nope probably not. A stock market crash wont affect any other parts of the market or economy save for the bigger entities on the stock market. Usually the stocks hit rock bottom and everyone looks around and says Geez did that just happen? Ok lets all invest in gold or real estate or Bitcoin or beanie babies or smaller companies. And then they all pick one sector and invest. Pretty simple fallout. Smaller companies are the backbone of America you know.,2016-12-07T05:30:06.000Z,0.25
1294193,-6.0,0,Bitcoin is a whole different giant. If you want to be successful in Bitcoin stock essentially you need a heavy duty computer for mining and a thorough insight of cryptocurrencies rBitcoin can certainly help if you want to make beyond a buck or two. Otherwise I found alternatives like PayCoin to be helpful albeit short lived for the whole buy low sell high deal. Theres a tote board on Cryptsy I believe with the highest value CCs online. They tend to work with direct deposits from a bank account.  Good luck!,2016-12-28T06:34:28.000Z,0.5
1294194,17.0,0,You keep putting your ideology on bitcoin. For example you might have said  years ago the internet was created to make sure information is not centralised. Yet Facebook is the most centralised institution for information.,2016-12-26T21:44:38.000Z,0.25
1294195,15.0,0,Guy must have blue balls trying not to jump into online discussions. He probably goes to Bitcoin meetups and people tell him that his views are not in alignment with Satoshis vision must be frustrating hearing people quote him out context and him not being able to say he is the Batman.,2016-12-09T05:09:59.000Z,0.0
1294196,88.0,0,gt What are you guys smoking  Thanks to Bitcoin pretty much anything you want to.,2016-12-07T22:51:58.000Z,0.75
1294197,33.0,0,This is hands down the best analysis of bitcoin price trends Ive ever read.,2016-12-28T01:32:03.000Z,0.25
1294198,-15.0,0,Economic changes are being pushed by one side you. The status quo always has been blocks will get full fees will go up. You are advocating a change from that in order to intentionally in a planned way keep fees artificially low. That is nonsense.  EDIT  gtSatoshi The incentive can also be funded with transaction fees. If the output value of a transaction is less than its input value the difference is a transaction fee that is added to the incentive value of the block containing the transaction. Once a predetermined number of coins have entered circulation the incentive can transition entirely to transaction fees and be completely inflation free  Hijacking Bitcoin development is not easy as is demonstrated by XT Classic BU and whatever else comes next. People choose to run Bitcoin Core. Most people. Almost every business. The developers for Core collectively choose not to do something they see as incredibly stupid in their software and most people agree with them by continuing to run it.   As for developers with relatively smaller contributions they are meek and easy to manipulate? You are fucking psychotic seweso. Those people choose to contribute their time and efforts to that software. Why wouldnt they just go work on an alternative client if they disagreed with what Core was doing?  And finally the fact that you think you are entitled to just have them work on Bitcoin no matter what even if people muscle in and do things they think are dangerous stupid and unwise is just beyond an insane thought or delusion.  This place has gone bonkers batshits bananas.,2016-12-11T08:20:01.000Z,0.25
1294199,43.0,0,Theymos has singlehandedly done more to divide the Bitcoin community than any other person without question.,2016-12-07T06:06:54.000Z,0.25
1294200,-8.0,1,Ok guys I am signing off. leaving this forum. I am moving on to other things in life. My buy in for outright bitcoins was at  however I did trade for a few months and I made enough off trading to be set for life over the past few months.  I would especially like to thank a few people on here who told me a few months ago to stop posting analysis without having skin in the game. I listened and I owe it to you guys.  I am invested in bitcoin longterm so I will continue to monitor the price although not as much as I have in the past maybe force myself to only look max  times per day.  To my haters I am not upset the stats are that  of you will lose money I knew this so it hasnt bothered me. If I had been upvoted each day maybe I wouldnt have made successful trades. So regardless of the process I am happy with the outcome.   I think that maybe this forum should experiment with say a week of no option to downvote posts it might encourage more open discussions for differing points of view. Many people get chased away the way things currently stand since not many people want to deal with a barrage of downvoteshate each day even if they are making the winning trades.   To the daytraders who are following a plan and are disciplined in their decisions it gets better  one day you will be able to leave the stress behind and sleep peacefully at night you are working hard now so you can have a better life in the future. It is challenging but if you survive the cut it will be well worth it.  Adios and good luck.,2016-12-25T23:14:15.000Z,0.25
1294201,15.0,0,After many months studying the market behavior and crypto technologies engineer here i really think that BTC cant be a widely used currency. It is a store of value but not even the perfect one. The crypto market is like a children right now. As it appears with recents news banks experiments conferences.. crypto will be a major change of the next  years and bitcoin is not the currency that the wide public can use for obvious technical reasons scalibity performance utility  What about alts ? Monero is like bitcoin but i dont think the public values privacy THAT MUCH. The major goals are scalabity performance and stability. The major part of alts are failures or future ones. Ethereum is not able to provide any a these YET. But the way their improve and forsee the future is the best ive ever seen in crypto and if they manage to reach their objective i believe ETH could be the major crypto along BTC. This is not stupid hype this is realism OF COURSE it could fail but Vitalik and his team are the most promising organisation in crypto. The projet is in alpha stage right now and this bear market is totally showing that but in the long run if nothing else amazing comes to life in crypto Ethereum will be to crypto what Microsoft is in IT and i think many actors have understood that.,2016-12-26T03:19:13.000Z,0.25
1294202,32.0,0,Vitalik actually calculated how secure Bitcoin is when you take away the mining rewards.  It would cost approx. between  million USD to perform a so called Maginot line attack  source,2016-12-29T21:03:29.000Z,0.25
1294203,24.0,0,ETCs devs and communities have had  months to do anything.  So far they have not developed the protocol at all not a single bug fix or anything added just them copy and pasting the EFs work.  They have not developed a single dapp or announced one.  What does that tell you and prospective investors?  What is the Ethereum technology without any development?  Its an inferior Bitcoin with less network effects than either Bitcoin or ETH.  ETC has no interest in being their own thing because they have nothing to be.  There is no there there.  Their first ICO was the first true scam on Ethereum the BorgDAO.   jailhttpswww.reddit.comrEthereumClassiccommentseleceric_hoffmann_erichoffmannusdojgov_of_the_usdipa.,2016-12-19T15:14:40.000Z,0.25
1294204,-6.0,0,Which altcoins are you worried about? From what I see bitcoin has been in a bull market and altcoins like ethereum and monero have been dumping.  But yes I agree with you about the block size lets hope that segwit activates as soon as possible.,2016-12-09T14:31:55.000Z,0.25
1294205,-8.0,0,When something is not good for Bitcoin this sub DEMANDS sources and proof. Because bitcoiners are highly critical! When its good for Bitcoin it gets upvoted to the mainpage without questions asked.,2016-12-03T22:18:32.000Z,0.25
1294206,-10.0,0,The only special snowflakes are the ones who echo Roger Ver insisting they didnt do nothing when they got banned from rbitcoin   Sounds bad until you look at their posting histories and then you see why collecting them all in rbtc makes it a cesspit of vile lies and direct personal attacks on the hardworking men and women trying to make Bitcoin work led from the top down by Roger Ver and his paid powerlusting henchmen,2016-12-03T02:08:39.000Z,0.25
1294207,-8.0,0,How ironic of you to do this considering the cheating they exposed in the video with rbitcoin is done by you and the trolls you pay. Its like someone robbing a bank then going to the police and saying hey watch out for those guys over there hey look suspicious  So you want them to do their next story covering rbitcoin just because their st bitcoin story was exposing the fakery and lies that you pull every single day to lie and manipulate your way to fake suppport.  How disgustingly ironic,2016-12-16T11:14:50.000Z,0.25
1294208,-6.0,0,If you believe Roger Ver the Core Devs are immoral monsters so evil even their code must not be touched. The truth is that these people who devote years of their lives to the Bitcoin codebase are working to enrich the world with a Bitcoin that can stand the test of time and Roger Ver who has never even ever made so much as a post to the mailing list spends all his time harassing these developers hiring minions to harass them and cheerleading attacks on them totally baseless accusations and conspiracy theories and lies basically all day every day.,2016-12-03T02:22:43.000Z,0.25
1294209,26.0,0,what bugs has luke introduced to bitcoin that took x number of developer hours to comb through and fix?  Seems much more likely you just found an article that someone wrote about a negative experience they had with a bad developer and thought to yourself what developer do i not like? and then somehow merged the article with luke.  I imagine this is related to  of a couple of things things. Either his religious beliefs which have nothing to do with bitcoin and shouldnt be relevant to any discussion here or the fact that he supports the idea of smaller blocks. Well first of all if a case can be made for no block limit a case can be made for a moderate block size increase and a case can be made for keeping the blocksize the same why is it heresy to make a case that the blocks should be smaller?  His priorities are about making bitcoin as resource inexpensive as possible such that someone can be a full node even under harsh circumstances bad network weak hardware. These are all valid arguments and while you might not agree with his priorities which is fine attacking and mocking him for it is quite fucking childish.   If your argument that he is actively trying to impede forward progesswhich is quite frankly absurd well the same case could be made for people here who dont support segwit.,2016-12-19T05:19:11.000Z,0.25
1294210,25.0,0,gt uh... Is hashcash not the PoW algorithm at the center of bitcoin?  What the hell? Where do you people come from?,2016-12-29T11:45:26.000Z,0.25
1294211,24.0,0,Here is how it breaks down  ..  is the paypal fee for international transactions.    is the exchange rate fee. You get  less Rs for each USD received on PayPal.  . is the current difference between selling price on Zebpay and international rates of bitcoin with bitcoin selling for a premium on Indian exchanges like Zebpay.       .  . is what I see.    I am a freelance programmer from India so I know this stuff.,2016-12-22T04:11:52.000Z,0.25
1294212,21.0,0,I will always remember this video from Sept   years.,2016-12-21T14:18:34.000Z,0.75
1294213,30.0,0,Yeah have to agree. There is no way  know what a Bitcoin is. I would imagine its more like   maybe  at a push.,2016-12-25T18:37:44.000Z,0.25
1294214,23.0,0,mmmh you cant see it that way. had you invested your dollarz into bitcoin I GUARANTEE YOU as soon as these little bitches hit  cents or even  cents you would have sold that shit. The fact that you considered dollarz a lot of money back in the day should tell you everything.  Just think about seeing your money x or x in your bitcoin wallet?  You cant honestly tell me you wouldnt have pulled the trigger.  Fantasizing about the current value of your dollarz being worth million isnt going to bring you very far since you DO NOT KNOW what you would have done during the steady climb of bitcoin.  This scenario has regret written all over it. even with a k profit you would be mad  yourself. So cheer up and look for the future bitcoin and while youre at it send me a PM as soon as you find it   PS my biggest regret was selling k AMD  shortly before it skyrocketed to .,2016-12-28T15:17:22.000Z,0.25
1294215,65.0,0,Exactly. The current financial system depends on the suffering of weak currencies for there to be strong ones. When India wiped out over  of its currency recently future.,2016-12-25T15:57:40.000Z,0.25
1294216,22.0,0,everyone is opposed to violence. If the capitalist class would be so kind as to hand over the MoP that would be much preferred. But if history is worth anything at all that will obviously never happen and not only that such transitions are usually met with reactionary violence and oppression.  So no just because you are abhorrent to it doesnt mean violence isnt an option.  DAOs and Bitcoin specifically have absolutely nothing to do with socialism at all. But yes Im of the rare opinion that things like worker and consumer cooperatives are  competitive with traditional enterprises in fact they have much higher success rates than traditional small businesses at start up and  have the capacity transition society as a whole to a more egalitarian one. And that point coops and their communities could organize themselves into any traditional format of nearly every socialist or anarchist school of thought one could conceive.,2016-12-13T21:22:55.000Z,0.25
1294217,16.0,0,Downvotes on rbitcoin dont really obscure anything. Comments dont get collapsed and you cant see vote totals for about  hours. The only thing that would change is the order of the children but your comment has no siblings at the moment.  I think Satoshi would have been fine with bigger blocks but he would have wanted users to pay for them it.,2016-12-09T00:32:06.000Z,0.25
1294218,16.0,0,Small blocker is a misnomer. All socalled smallblockers support SegWit which is a max block size increase. Many also support an eventual hardfork max block size increase. The better term is decentralist.  A larger max block size would have many advantages   Itd be much more expensive to disrupt the network by spamming transactions and the continuum of fees would become more smooth. Thisd reduce but not eliminate the instances of stuck transactions. Though the real solution to stuck transactions is fee bumping by wallets.  Transaction fees would go down which would make Bitcoin more usefulattractive. I personally am not worried about how this would impact total mining rewards since the subsidy is very high it will remain high for at least  years and I suspect that in the far future miners can be funded by assurance contracts andor other alternatives.  The max block size is a form of decentral economic planning which is distasteful for many reasons. Though I believe that for Bitcoin to have any security at all some fullnodeenforced limit maybe not a single global limit is just as necessary as the  million BTC cap which is equally a form of economic planning.  In the first few years of Bitcoin using Bitcoin was extremely convenient. You could take anyones address and send them nearly any amount of BTC immediately usually with zero fee and your transaction would almost always get confirmed in the next block. It felt like the Bitcoin block chain was a limitless ocean of capacity. This was really nice. Unfortunately this was only possible because Bitcoin was absolutely tiny then and it will never happen again onchain even if blocks became unlimited. A very similar feeling might eventually be possible with Lightning and welldesigned Lightningsupporting wallets.  It is a reasonable thought to argue that itd be good for Bitcoin to grow very quickly so that it becomes so entrenched in society that fighting it becomes difficult. But anything that causes such superfast growth would probably weaken Bitcoins security so much that governments could easily coopt it. Even today the Chinese government could via miners totally shut down Bitcoin overnight the only defense against this is a strong fullnode economy credibly able to threaten a PoW change. Satoshi thought that each governments desire to control the worlds currency might eventually lead to a stalematecompromise in which theyd agree to leave it decentralized but IMO its more likely their compromise would be to create some abomination. Its better to take as much time as is needed to make Bitcoin so secure and decentralized on a technical level maybe even more than Satoshi thought possible that it is beyond attack from any adversary.,2016-12-03T18:20:21.000Z,0.25
1294219,26.0,0,Seriously Greg Maxwell? Your momma ever wash your mouth with soap?  I have been in this space for two months and I dont think I have ever seen a technocrat with such a bad mouth suggesting he represents everything around him who just doesnt bother to research some very basic stuff.  The constant made up stories Roger Ver funds everything that is not blockstreamcore puts you in the running for the Pants on Fire boy of the year.  Maybe you need another break?  There are some of us that will gladly fund Bitcoin to keep it out of the hands of turkeys like you.  Are we done Greg?,2016-12-11T03:32:56.000Z,0.25
1294220,-6.0,0,I cant tell if you are joking.  Open the Bitcoin white paper and ctrlf hashcash.,2016-12-29T18:51:34.000Z,0.25
1294221,14.0,0,I like reading about bitcoin especially technical discussions and different viewpoints.  rbitcoin is about bitcoin  I dont like their censorship although Im starting to suspect its greatly exaggerated  rbtc is about rbitcoin Censorship on rbitcoin How Core sucks How nullc sucks How theymos sucks How lukejr sucks some alt coins and occasionaly about bitcoin  I had hoped rbtc is a place where free conversation and alternative ideas about bitcoin could happen but it seems obsessed by topics I have no interest in,2016-12-16T04:50:33.000Z,0.25
1294222,-4.0,0,Curious why you believe Flexible transactions is good solution? Have any notable devs come forward in support of it? The technical feedback on Bitcoindev mailing list was rather critical.,2016-12-17T16:18:50.000Z,0.25
1294223,15.0,0,CFP here...Alpha measures returns against a similar index. Even if there was an index for Bitcoin it would be made of things directly linked to that specific security. Its not like comparing the returns of EOG or XOM to the XLE. Its like comparing the price of oil to XLE which is directly linked to the price of oil. Alpha is just a terrible way to measure a security as young as Bitcoin.,2016-12-26T00:32:34.000Z,0.25
1294224,45.0,0,This is good for bitcoin,2016-12-14T07:18:24.000Z,0.75
1294225,-7.0,0,gt Theyve also banned almost everyone who doesnt adhere to their corrupt corporatepolitical vision of bitcoin  No they banned people who were brigading the sub with big block propaganda and had no intention to debate anything.  gt complex CSS to sort comments and block views that do not support the rbitcoin politburo.  They dont change the sorting with CSS they put sorting on controversial when an obvious brigade attempt is going on You dont need CSS for that. The CSS is used to MAKE ALL COMMENTS VISIBLE not to block comments. They use custum CSS to unhide downvoted comments.  gt Most posts are propaganda and there are few posters left beyond the shills.   Thats indeed the case for rbtc  gt Most bitcoin enthusiasts are in rbtc now.   Literally zero bitcoin enthusiasts are in rbtc. rbtc consists of bitcoin haters altcoin pumpers and paid shills spreading bitcoin.com links and big block propaganda.,2016-12-15T23:50:55.000Z,0.25
