_c0,score,controversiality,body,timestamp,sentiment
1293613,16.0,0,You need to seek mental health help buddy.  What youre describing is eerily similar to gambling addiction.  The fact that you think you can even chase your losses by taking another loan further contributes to the view that youre struggling with a very real mental health issue.    Im not sure what youd get by trolling us with a fake story as were not even a large sub so how much karma can you rake in? so Ill give you the benefit of the doubt and assume youre being honest.  Please get help. And please do not take out a loan. Take a break from bitcoin. Forget the dream of making money quick.  This is the number one magical thinking cognitive distortion that drowns gamblers.   Whether your post is real or not it can still serve as a PSA for other folks who may be approaching this persons situation.,2016-12-13T05:47:21.000Z,0.25
1293614,-6.0,0,People running their own nodes and inviting others to connect to them  Centralization.  People running nodes and only connecting to their business partners like bitcoin.com and viabtc in this post  Totally not Centralization.,2016-12-08T07:21:07.000Z,0.25
1293615,14.0,0,gt The major reason why a block size increase hasnt happened yet  Heres the main reason them.,2016-12-08T06:04:58.000Z,0.25
1293616,17.0,0,At this point Id say theres a very good chance BU will happen no matter what core or small blockists think. Its just a matter of time. This comes from the same vision that many of the early adopters who make up rbtc had for Bitcoin early on.,2016-12-30T01:57:39.000Z,0.25
1293617,14.0,0,Actually Im pointing out that Bitcoin is now officially in a hype cycle and this often precedes a price event.,2016-12-25T03:29:47.000Z,0.75
1293618,-6.0,1,gt Core and Blockstream are not the same entity so it comes across as trolling.  ...and this you have to explain to somebody who calls himself Worlds first Bitcoin Investor a man who is on reddit for  years now. Please gimme a break! This guy is trolling the trolls by trolling himself a bizarre behavior absolutely strange!  Edit spelling,2016-12-11T01:31:57.000Z,0.25
1293619,-6.0,0,As serious as your statement that you are done with bitcoin.,2016-12-07T21:00:07.000Z,0.75
1293620,-23.0,0,gt The devs such as unullc believe in something different than what the original design of bitcoin calls for. They believe that bitcoin should be a settlement system and not a peertopeer cash system as designed by Satoshi Nakamoto.  gt As such devs like unullc have gone out of their way to redesign the system to fit their needs and unullc Gregory Maxwell even created a company that has like  million in venture capital backing it called Blockstream. He uses this company to fund development for this settlement system.  uMandrik do you think its okay that BitcoinXio is posting attacks and misinformation like this?,2016-12-02T18:28:51.000Z,0.25
1293621,-4.0,0,They do actually though Ithink Iheard that they legit want to switch to bitcoin  Edit its not the bitcoin but they are digitalizing. Why the hell are yall down voting me over Ecuadors actual currency? httpswww.google.com.twurl?satampsourcewebamprctjampurlampwww.cnbc.comampecuadorbecomesthefirstcountrytorolloutitsowndigitaldurrency.htmlampvedahUKEwiVqcry_rQAhVLnQKHZQjDdAQFggtMAEampusgAFQjCNFR_RdFTtMFlCEtkHbWD_P_Ww,2016-12-16T16:00:44.000Z,0.25
1293622,16.0,0,Im not a trader Im a citizen of the internet. I hold my value and transact in my home currency of bitcoin as much as possible. Not because I hope it will make me rich but because I believe its the best way forward for society. Control over money is too powerful to give to anyone its time to decentralize it.,2016-12-23T19:40:31.000Z,0.25
1293623,19.0,0,Anyone else find it strange that they explicitly recommend users go to Coinbase to buysell bitcoin? Coinbase was a direct competitor to Circle now out of the blue they are endorsing them? Just some food for thought. I feel like this might be just the tip of the ice iceberg in a greater motive.,2016-12-07T05:57:41.000Z,0.25
1293624,-9.0,0,Put the data online and a bitcoin bounty.. Let the worlds geeks solve it.,2016-12-05T10:29:18.000Z,0.5
1293625,-4.0,0,When people blindly purchase bitcoin it is the time to buy ether coin.,2016-12-27T14:44:17.000Z,0.25
1293626,16.0,0,Not bitcoin or silver dimes?,2016-12-06T01:22:10.000Z,0.5
1293627,23.0,0,The problem they segwit authors are trying to solve can be solved in about  new lines of code. They did it in many thousands.  The reason for this is that they held themselves to avoid one step which is to have a hard fork. They required to do it as a soft fork instead.  So what they could have done is  . change the transaction format.  What they changed instead is  . how transactionscripts are found . how transactions are transferred over the pp network. . how transactions are stored in a block. . we now have relevant data in the coinbase transaction. . block size calculations are changed. . sigop limits are changed . it changes the bitcoinaddress type people can use . a whole new datastructure is added which is consensus critical . introduces new opcodes to fix problems found after the above were done. . how signatures are validated quite extensively.  They even made clear at the Milan meeting they were proud that this change touches all parts of Bitcoin. That is not something to be proud of that is something that should tell you that its not done right.  The sad part here is that the entire reason for doing it as a soft fork is to make sure that most parts of the network dont have to upgrade and thus make it much safer to roll out. The reality is that practically all of the ecosystem will need to upgrade to get this working and on top of that the much higher complexity over a competing solution safe.,2016-12-13T16:37:31.000Z,0.25
1293628,174.0,0,Exactly. The only evidence that has been offered so far is the use of Russianderrived hacking tools that Kaspersky has published extensively on and which are available on the deep web to anyone with a small Bitcoin wallet.   I can say with experience though that Russian statesponsored cyber attacks dont leave neat breadcrumb trails to follow and they dont use twogeneration old hacking tools that anyone in the world can obtain.   ....but even if it was the Russian government its not like they fabricated anything. All the information was genuine and true so if voters made choices based on that information then instead of blaming Russia the DNC should be trying to avoid including despicable people who would do that sort of shit to begin with. Corporate media has ceased publishing the revelations contained in the wikileaks dumps and instead only seems to want toocus on where the information came from.,2016-12-11T14:51:56.000Z,0.25
1293629,25.0,0,geez finally someone posts a picture of one of these...he should have put his name on it and left that image off of it.  I mean I like him and all but it just doesnt belong there and probably confuses people even more about what Bitcoin is.,2016-12-10T20:51:18.000Z,0.25
1293630,27.0,0,Cash here has a technical meaning distinguishing it from systems of credit. E.g. a Chaum bank or Zerocashlike system is distinctly cash like because you cant trace coin histories whereas VenmoPaypal like systems have coin tracing as a feature not a flaw. Satoshi calling bit bitcoin pp electronic cash is describing in academic terms as related to these sorts of privacyprotecting cryptographic ledgers.,2016-12-13T20:21:15.000Z,0.25
1293631,15.0,0,Qualification for Blockstream Diss alternative Bitcoin clients. Must be a wonderful work culture.,2016-12-21T23:38:54.000Z,0.25
1293632,-9.0,0,This was probably developed to appeal to the Chinese who will think they will make not only all the mining hardware but scaling hardware too. Guys we need to balance the power the Chinese have over Bitcoin not sway it even more in their favour. Western LN hubs or Chinese scaling device? Maybe you should consider joining blockstream in dismantling this Trojan horse rather than supporting it by allowing these threads endorsing it. Nakamoto must be roling in his grave.,2016-12-25T10:42:18.000Z,0.25
1293633,-4.0,0,A year and a half of urgency.  Haha.  Guys quick.  Its urgent!  In a year I am going to have a heart attack.  A year and a half later.  Theres still a sense of urgency!  I havent had a heart attack yet.  You need to consider what urgent means.  And changing its meaning is a cheap equivocation that will not work on any reader in a thread Im participating.  To be clear this was the prediction of the poisonous person  gtnever have blocks that are  full all of the time  gtIf the number of transactions waiting gets large enough the end result will be an oversaturated network busy doing nothing productive. I dont think that is likely it is more likely people just stop using Bitcoin because transaction confirmation becomes increasingly unreliable.  All wrong.  The blocks filled and the network keeps on being productive to process transactionsthe higher fees go first.  And the market loves this behavior and therefore raises the value.  There was never any urgency.  And Gavin knew it.  He was just being that poisonous person that claims the world is ending.  That poisonous person who writes a post about poisonous people just to attack ulukejr one of the most genuine smartest and hardworking developers we have.  And why did he do this?  Because Luke disagreed with him.  Gavin is the epitome of a poisonous person.  The only reason this community is even divided is because he selfishly did it to stroke his ego by accomplishing his agenda.  But he failed in his agenda leaving a mess in the wake.  He was miserably wrong about the urgent problem.  He was wrong about the market leaving.  And he lied about fake Satoshi.  Meanwhile Lukejr. codes and proves time and again to be a far superior developer to Gavin with much better foresight on Bitcoins behavior.,2016-12-08T02:15:42.000Z,0.25
1293634,25.0,0,gt First of all you are changing the serialization format. With an immutable dataset such as bitcoin this is a very high price to pay because it means that every software will have to support two completely different serialization formats indefinitely. You can never deprecate the existing format.  Although indefinitely might in theory mean forever I can imagine that a better serialization format will be used in . of cases in the future and at some point most wallets dropping support for it.  If you then come across an arcane oldtype transaction in the old format your wallet might signal an error and you might want to get an old client fired up to process that transaction  should you deal with that data directly.  But miners and full nodes probably need to support this forever or at least a very long time yes.  I think we should take some more time years to get this right. I think uThomasZanders efforts are promising but I really think we should think this through.  But this also is absolutely true for SegWit. Lets wait until after a blocksize increase and when the dust has settled on this issue and when the space might be again more polite and professional and less flamewars are fought.  Lets not rush something that needs support forever and lets not rush on touching what might be delicate tradeoffs between off and onchain transactions with SegWit either. More thoughts here fix.,2016-12-15T23:09:43.000Z,0.25
1293635,28.0,0,Changetip  dont forget Changetip It closed.  I made nearly .BTC from insightful and helpful comments in the other place and was looking forward to spending it on an interesting chemical when I had saved enough but that plan was thwarted when Bashy closed my tip input facility unilaterally because he found I posted here a lot.  Changetip  The Bitcoin company where even the CEO sent the wrong amount with a typo.,2016-12-27T08:26:54.000Z,0.25
1293636,26.0,0,gt I was gonna start my business with this graphics cardsBitcoin mining etc.  This is a lie you cant mine bitcoin profitably with graphic cards because this was only done profitably in the very early beginning.  If you stupidly lie about this what more would you lie about? Everything,2016-12-04T22:24:25.000Z,0.25
1293637,19.0,0,Last speculation video I posted here was a good hit. Heres my current position on Bitcoin now and the future  Cheers,2016-12-17T16:43:59.000Z,0.25
1293638,18.0,0,So you trolled Satoshi?  Ballsy.  On an unrelated note I predict Bitcoin will be exactly  on Jan st .,2016-12-11T17:52:38.000Z,0.25
1293639,25.0,0,I like the idea of you agents having a blacklist. Thats smart.  Have you looked into Bitcoin? More sellers need to take it  almost instant  cant revers it and much lower fees than WU.,2016-12-05T17:11:30.000Z,0.25
1293640,-12.0,0,Youre stupid so Ill explain it. Open up a blockchain account. This is a bitcoin wallet website. Buy bitcoin send bitcoin to your blockchain wallet then send the amount you need for the IDs to the address God told you to send to,2016-12-22T19:01:45.000Z,0.25
1293641,32.0,0,Bitcoin,2016-12-09T00:39:57.000Z,0.5
1293642,26.0,0,Im Sythlylariancarthalia Misandryaif youre not willing to learn to pronounce my name then youre a racist and Im a demisexual polymorpharomatic fat positivethin negative genderqueernonphallic nonvaginal presenting sexual assault surivor times mostly from stare rape OCD Aspergers midfunctioning Autism PTSDYes you can get that from anon hate.. educate yourself Phobias include but are not limited to social interaction bees spiders clocks personal accountability getting a job leaving my bedroom logging off Tumblr etc.  My triggers includebut not limited to responsibility maturity accountability penis grow up get a job etc. My pronouns are veraverasveraself As I am unemployed due to disability from various self diagnosises and because as an aloe verakin I need plant foodlike candy bars and stuff please donate to my cause so I dont have to get a job which can be very triggering for me. I currently take bitcoin ty EBrjtTFWwkVvmnnQqHTMETRyjgnnna,2016-12-02T22:17:19.000Z,0.0
1293643,23.0,0,You should definitely prove your superior economic acumen by developing a decentralized alternative to Bitcoin that the market values at  a coin.  Until then Ill stick with Bitcoin.,2016-12-08T00:05:27.000Z,0.25
1293644,15.0,0,gt Circles announcement comes less than a week after a federal court ruled that the Internal Revenue Service could serve digitalcurrency startup Coinbase with a summons seeking detailed information on customer transactions. Coinbase which hasnt been charged with any wrongdoing said it would fight the governments sweeping request. gt gtCircle which said it hadnt received a similar letter will partner with Coinbase for Circle customers who want to continue to buy and sell bitcoin. The price of bitcoin has risen in recent weeks with some investors using it as a hedge against inflation like gold.  Not buying it. The move or at least the timing was a direct response to a calculation Circle did with respect to the legal costs its likely to incur to fight the IRS dragnet when it inevitably turns its attention to Circle.  If youre relying on a centralized AMLKYC exchange for any part of your personal or professional livelihood you have been warned to find an alternative.,2016-12-07T15:02:32.000Z,0.25
1293645,26.0,0,because you are a normal human being who doesnt care about amlkyc because you have been doing it all your life and you keep hearing Bitcoin will be a good investment. Most people dont have a libertarian agenda and are drinking apl the government koolaid.   now that it will be harder for regular folks to get bitcoin bitcoin demand could dwindle and the price could go down.,2016-12-07T16:56:54.000Z,0.25
1293646,22.0,0,The quick answers  gt Is there like one program that randomly generates Bitcoins?  The Bitcoin source code run on all of the minersnodes in the network awards new Bitcoins to the miner who solves each block.  This happens on average every  minutes and is currently worth . Bitcoins.   gt How could Satoshi code Bitcoin?  He was a genius.  gt How did Bitcoin become popular?  Cryptography nerds though it was cool.  Someone traded   Bitcoins for a pizza.  Bitcoins gained a market value and the limited supply meant they increased in value. Bitcoin was the only way to buy drugs on the Dark Net or donate to wikileaks increasing demand. Libertarians adopted Bitcoin. A lot of people said Bitcoin would die but it didnt. I adopted Bitcoin. You adopted Bitcoin.  gt Are there Bitcoin servers where theyre are officially generated.  As above the new Bitcoin are given to individual miners when they solve blocks. The whole network agrees on this without a central authority yes its pretty magic.  gt How are they verified?  Cryptography tracing each coin in each transaction right back to when it was first gifted to a miner.  This is done by the nodes in the Bitcoin network.,2016-12-26T08:39:34.000Z,0.25
1293647,-6.0,1,Gosh.  Seems to be a growing sentiment doesnt it?      Circle just bailed for the exact same reason.  An entire company whos entire M.O. was Bitcoin just walked.     Coinbase  arguably Bitcoins only reason for widespread success thus far issued the same warning for the same exact reason.      Gavin  who worked directly with Satoshi has repeatedly said the exact same thing.  And plenty others who you all sarcastically dismiss as ragequitters.  So whats the rational response to all of that?  Just call them idiots stick our heads in the sand and dismiss everything theyre saying?    More and more people and companies  all saying the exact same thing.  Dont some of you find that to be strange if theyre all just wrong ?,2016-12-08T21:12:05.000Z,0.25
1293648,25.0,0,Hi Doctor.  Can I get some medical advice?  Every time the bitcoin price rises I get a large erection. Is this normal?,2016-12-13T20:37:23.000Z,0.25
1293649,16.0,0,BlockstreamCore regularly attempts to destroy anyone that stands in their way. Blockstream has basically stolen Bitcoin  which used to be an open source project  in order to make a select few Blockstream developers billions in the future by only working on code that supports their moneymaking endeavor.   This is why we must remove them from any sort of power or legitimacy immediately. They dont stand for users they stand for themselves and only their own desires. They dont care about Bitcoin as onchain digital cash. They want centralized hubs  also known as banks  to control the flow of your money. Dont listen to their lies. They deserve every bit of comic parody against their sacred cow Segwit because what goes around comes around. Users will not be silenced.,2016-12-19T21:46:20.000Z,0.25
1293650,18.0,0,Who Mostly people who know how to code and want to get information about people or just damage a computer. Why As I said before to damage computer get information try to get money Ransomware.  How Theres a plenty ways how they work.  Ransomware for example blocks completely the computer encrypting files with a password and making it unaccessible to the host. You get a bitcoin account and you are asked to pay a certain amount of money if you have  this kind of problem NEVER PAY. Just call the police  A trojan is a virus which will let remote access to the person who infected it allowing him to do whatever he wants. Just as if he was in front of the computer.  A worm  barbodelli will explain it nice here down!  Edit I forgot about antivirus. Yes they are useful. They work with a big database of virus around the world and are able to detect them before they do serious damage. Anyway the best antivirus is you.,2016-12-08T19:35:04.000Z,0.25
1293651,30.0,0,gt First of all its simple yes that doesnt mean it is any better necessarily but it allows for much more economic innovation.   Exactly what is the economic innovation that can be done with bitcoin and not with our current system?  gt having people have their own safes wallets that are completely private   The current system can be totally private  just perform all your transactions in cash.  gt and only accessible by the owner is intriguing.  Technically the current system allows for only the owner to access his money.  Any loopholes e.g. court orders extortion etc are works for both systems.  gt In poor nations with oppressive regimes there would be no way the government could control the economy in a simple way.  If its an oppressive country they would just enforce everyone to store their coinswallet on an government controlled exchange and then control the one exchange from their offices.  Much easier than interacting multiple domestic and foreign banks.,2016-12-19T12:28:16.000Z,0.25
1293652,-4.0,0,gtWhat exactly do we have to gain except Bitcoins success?  A Bitcoin with an artificially low throughput and relatively high fees is a fertile ground for the complex overlay network solutions your company is developing. In a sense youre in the enviable position of determining the characteristics of your competitors onchain Bitcoin tx product.   Inversely letting Bitcoins native capacity and utility grow actively hurts the competitiveness of your companys perceived prospective products.   The pervasiveness of this suspicion about your company would be greatly lessened if you had publicly published a business plan that indicated otherwise offering plausible alternative revenue streams.  So far investors including insurancebanking giant AXA have plowed in  million in return for shares in your company. You have one public product Liquid sidechain which has been confirmed to be indefinitely delayed,2016-12-27T03:32:56.000Z,0.25
1293653,109.0,0,I love it... but a slight recommendation for the bottom section to buy Bitcoin incase OP made it  Divide the sections horizontally instead of as two towers. It implies that the left tower is for Android and the right tower is for iPhone.,2016-12-25T23:27:21.000Z,0.25
1293654,50.0,0,There is literally no point in using circle now. Venmo already has all my friends. They have no reason to use it. The only way I got some of them to use it was if they bought bitcoin.,2016-12-07T05:02:44.000Z,0.25
1293655,29.0,0,Actually the concept originates from  bitcoin wizards IRC discussions  years before bockstream existed.  We implemented a nonbackwards compatible version of it in the elements sidechain which because it was a new sidechain it didnt need because malleability is a problem that has to be fixed for many smartcontracting use cases.,2016-12-03T22:14:33.000Z,0.25
1293656,-8.0,1,You dont need to be a paid shill to see that the Core team is a vibrant community of mostly volunteers who like to improve bitcoin while BU and Classic are lone wolf implementation paid developers without any community help. Seriously if their ideas are so good why is nobody helping them?? Its because every dev with some skills sees that these implementation are highly flawed and nobody likes to waste time.,2016-12-01T02:51:38.000Z,0.25
1293657,26.0,0,So you gave links which show a mighty big overlap between the two. Where the developers not working for blockstream and which could and should have been influential are meek and easy to manipulate. The rest are not important or were kicked out and dragged through the mud.   I personally do not conflate Core and Blockstream. But even I know that Core as a software development process is easy to hijack. Especially if the only thing you need to do is block a certain change. Just perpetuate the danger of a hardfork. Censor all altclients which want to hardfork. And threaten to leave Bitcoin development for good and call it a complete faillure if a contentious hardfork were to happen. Its a darn good plan which worked wonders.   Meanwhile that still means we have software developers pushing economic changes without any type of design nor data to back up their plan nor any type of consensus.   So you tell me how is Blockstream going to turn a profit for their investors?,2016-12-11T08:07:04.000Z,0.25
1293658,16.0,0,It will be really interesting to see the medias reaction IF Bitcoin hits  again.,2016-12-17T07:44:51.000Z,0.75
1293659,22.0,0,If you believe in Bitcoin and want to profit from that belief then buy it and hold it. What you are doing has nothing to do with Bitcoin it is gambling with no advantage plain and simple.  I am truly sorry for your losses but please learn from them.,2016-12-13T05:18:30.000Z,0.25
1293660,-6.0,0,Bitcoin as a whole benefits from block size limits because the system only has value if its decentralized. Small and quicklyverifying blocks are a prerequisite for decentralization.  inb big blockers posting how bitcoin will stay decentralized if blocks were GB each as BitcoinXT proposed,2016-12-19T16:10:07.000Z,0.25
1293661,17.0,0,A Mr. Nice TN or a BDDMV u GA will work phenomenally in your college town.  As for how to use Bitcoin  first make an account on Coinbase do!,2016-12-28T20:51:31.000Z,0.5
1293662,20.0,0,Agree fully the current mechanism for gas limit setting sucks. We consider this to be one of the top problems in cryptoeconomics  not as important as Casper or sharding but definitely up there. All current approaches including bitcoin and ethereums have proven quite sucky in their own ways unfortunately.,2016-12-02T14:09:59.000Z,0.25
