_c0,score,controversiality,body,timestamp,sentiment
1294493,-18.0,1,gt Bitcoin Unlimiteds fast block relay Xpedited is the only decentralized fast block relay solution in Bitcoin  This is simply untrue.  Xpedited does nothing more than the high bandwidth mode of BIP deployed on and used by about  of all reachable nodes. BIP HB mode is used automatically without special configuration unlike BUs protocol and it also resists malicious shortid collisions and needs less data to communicate its compacted blocks.  Using Xpedited instead of plain old Bitcoin Core would be a step back.  And Id hardly call those figures _fast_ a network of nodes running fibre shares a block around then _entire world_ in the time cited here for crossing between two nodes.  and does so even when the transactions in the block are surprising ones so it doesnt depend on highly consistent mempool behavior and does so even when the networks are losing packets so its not just fast sometimes but all the time. The Xpedited numbers here are best case ones assuming strong mempool similarity but closer to worst case is a lot more important.  Edit Dont expect any replies from me MemoryDealers paid staff appear to have decided to put the rate limiting back on my account so I wont be able to reply in a sensible time or otherwise engage in conversation.  Edit Since I cant reply directly Solex wrote  gt Lyin Greg comes back from suspension and resumes lyin.  gt You keep parroting about collisions which dont happen even though Xthin has been live for most of this year. One user recently reported TB saved on bandwidth in a month. FIBRE network run by Blockstream employee using a few choice private servers does NOT  decentralization. It would be nice if you finally admitted that Xpedited is superior in not only design but also performance AND decentralization.  collisions which dont happen  collisions happen whenever someone wants to bother making them happen this is how security vulnerabilities work.  Since Xthin is used on only a tiny number of nodes its generally not worth it to bother attacking it no one would even notice. Just because someone isnt actively exploiting something at the moment that doesnt mean its not vulnerable. This weak design also makes xthin use  more data to communicate its compacted blocks.  Xthin has been live for most of this year xthin that actually worked sure hasnt been but here youre not even talking about xthin but Xpedited the uncredited clone of BIP HB mode.  FIBRE is a protocol and software that implements it everyone can run it,2016-12-08T04:19:40.000Z,0.25
1294494,20.0,0,So how much does one have to spend to be using bitcoin the right way?     How about buying pizza.   Is that okay?,2016-12-22T09:59:40.000Z,0.5
1294495,38.0,0,It is literally impossible to have a forprofit company with no conflict of interest when it comes to a publiclyowned utility. Telecoms want to fill underground tunnels that they do not wholly own with their own cables routers and switches in order to be able to sell internet and telephone services. Bottled water companies want to capture a certain amount of spring water from a spring which they do not own. Other types of companies that do not own those springs or underground tunnels also want to use them for their own profit making.   Blockstream does not own the bitcoin network. Nobody does. Each company wishes to influence the network for their own profit motives. They all have a conflict of interest. Coinbase wants the network to better serve their online wallet and exchange products. Trezor wants bitcoin to work more efficiently with their hardware wallets.   Ive asked several people on the other side of the blocksize debate about what the conflict of interest might be regarding Blockstream. Almost every time I get told that there is nothing. We are supposed to believe that a forprofit company possibly has zero COI when it comes to a publicly owned utility which they plan to use.  If this isnt insanity or extreme ignorance then I need to go check the dictionary.,2016-12-18T01:27:18.000Z,0.25
1294496,-5.0,1,Or maybe its because Bitcoin is slowly becoming successful after all because it is not a ponzi,2016-12-20T16:44:43.000Z,0.75
1294497,19.0,0,Unless you have a time machine.  I have some bitcoin somewhere from years ago but no bloody idea where.,2016-12-25T13:14:20.000Z,0.25
1294498,-5.0,0,Exactly censorshipresistance is more important than low fees in bitcoin.,2016-12-17T17:17:13.000Z,0.25
1294499,74.0,0,Its a pretty sad tweet. The insertion of that word feels very awkward.   Clearly he regrets ignoring Satoshi who told Adam about it when he released bitcoin and dismissing it for years. Like other Blockstream folks they didnt get it at first and I think most still dont really understand it now.,2016-12-29T06:55:53.000Z,0.25
1294500,-21.0,0,Better logic than blocking segwit then complaining about the mempool and shitting on Bitcoin while pumping alts.,2016-12-02T12:56:22.000Z,0.5
1294501,36.0,0,Eric I just want to add more. I think everyone should have a say in bitcoin. But now developers have too bigger say in this decision. Do you guys developers even know monetary policies? Do you guys even know economics? Bitcoin is not a computer project anymore. So guys before you touch the codes read some economics. Otherwise hands off.  Samson   I think better wallet software and better fee estimation are where we can work on. I believe better fee estimation will help with the long confirmation time.  Didnt you know? Better fee estimation will help with the long confirmation time!!!!!!,2016-12-13T15:35:09.000Z,0.25
1294502,33.0,0,They also constantly trot out the line how dare you criticize the efforts of all those Core developers volunteering their time! Conveniently ignoring that a significant number the majority? of the most active contributors are employed full time by private interests to work on Core.  I would love to see what percent of recent code in Bitcoin Core is written by the top ten contributors. gt?,2016-12-09T21:10:10.000Z,0.25
1294503,14.0,0,All Layer  solutions are centralized token systems backed by Bitcoin.  They are not bitcoin transactions.,2016-12-06T09:13:18.000Z,0.25
1294504,-13.0,0,Its great to see that the free speech bitcoin subreddit is angry about this censorship and definitely didnt push for this by for example report any thing.,2016-12-05T12:28:05.000Z,0.25
1294505,21.0,0,I was expecting just another lameo theory. Turned out to be possibly the best single analysis of Bitcoin adoption and price growth Ive ever seen. Hit all the bases correctly and synthesizes them into a coherent whole. I have nothing to criticize here at all just want to note that the percentage of the profits you take on the way up as you sell progressively into a bull run is a rather delicate matter. See this whole thread price.,2016-12-28T10:06:46.000Z,0.25
1294506,-14.0,1,Its already been proven that Ver lied about this and everyone knows that Ver has a history of being a liar. His reputation is well known everyone knows hes a liar and cant be trusted.  Roger Vermin isnt fooling anyone.  I was invited to the channel under completely false pretenses  LIAR and proven so  I was told it was just to talk with members of the community  LIAR and proven so   when I arrived there was a preplaned  vs  debate lined up that had been kept completely secret from me. LIAR and proven so  wow  massive lies at the very start thats the Roger Vermin we all know. The article had literally only just started and out pour the lies.   community.,2016-12-24T16:41:08.000Z,0.5
1294507,15.0,0,Seems like great news... it looks like Mulvaney is not only probitcoin but also against the fed system as a whole  Mother Jones obtained audio of Mulvaneys speech to the John Birch Society chapter. In the speech Mulvaney blasted the Federal Reserve saying its actions have effectively devalued the dollar and choked off economic growth. He praised bitcoin as a currency that is not manipulatable by any government.,2016-12-20T01:54:03.000Z,0.25
1294508,18.0,0,Thats how I see it. Reckless development in the style of Ethereum would have relegated Bitcoin to hasbeen territory long ago due to a loss of faith in the system.,2016-12-07T22:51:10.000Z,0.25
1294509,18.0,0,gt he has a high level of emotional bias towards Bitcoin  I Johnny Saneguy have no emotional investment in the matter as evidenced by my estalking someone for tattlepoints exchangeable  for Bitfinex megatokens surely you will see that HE IS THE REAL MADMAN CRIMINAL HERE.  Thank you good day sirs!!!,2016-12-11T06:32:15.000Z,0.25
1294510,35.0,0,Because its already been scrambled spent online respent used to buy bitcoincryptocurrency and those bitcoin have already been scrambled used and spent.  You have proof that that money was stolen but you dont really have proof that bitcoins that came out of a scrambler originates from that stolen money because the in and out accounts are not linked in any way.  EDIT words and french autocorrect. Also i am getting downvoted for actually telling the truth.,2016-12-03T00:17:45.000Z,0.25
1294511,19.0,0,Man when I cant tell if Im on bitcoin or the_donald subreddit my life is good.,2016-12-15T02:21:23.000Z,0.5
1294512,60.0,0,Bitcoin went up to  USD.  Then down to  USD with lots of people having the same feelings as you currently have.  Now Bitcoin is at  USD.   Current price doesnt say anything about future potential.  Ethereum is only . years old. The biggest events have yet to happen.,2016-12-02T12:23:57.000Z,0.25
1294513,-7.0,0,Just a small sample   uMoist  upinmore  uHarpua  uPosternut  ueok  uHKFrank  All link spamming bitcoin.com,2016-12-16T00:44:47.000Z,0.25
1294514,22.0,0,Finally an ounce of common sense on rbitcoin.  People claiming that tx congestion  spam attack are just pushing a narrative that I havent seen convincing evidence for.    Its plain to see btc is experiencing organic growth and becoming more popular.  This is a good thing but changes will be needed to accommodate more transactions because the bitcoin we have today will look very different if nothing is done.,2016-12-02T07:22:37.000Z,0.5
1294515,33.0,0,Its funny Bitcoiners have always said that Bitcoin lets you be your own bank. But really Bitcoin had only allowed you to be your own checking and savings account.  But with Lightning Network someone can actually accrue interest on their money by providing liquidity like a bank.,2016-12-10T17:23:35.000Z,0.25
1294516,17.0,0,One extra thing if youre buying more than  in Bitcoin please spend  on a Trezor or a KeepKey.  These are hardware wallets designed to be virus resistant and hack resistant. You can plug them into your phone or any computer which allows them to be around for years. You can also use them as hardware password managers that cant be hacked Trezor in particular,2016-12-23T21:25:49.000Z,0.25
1294517,22.0,0,No although I can see why youd think that. Actually many of us are excited to see the potential of offchainsidechain solutions down the road  but those solutions are totally worthless right now because the onchain foundation they rely on is unstable.  LN on its face sounds like a product Im not interested in as a consumer and a merchant. Ive no interest in tying up funds in a channel to facilitate commerce  thats an expensive unnecessary step that causes nightmarish logistics for my business dealings and sounds highly risky yes it only sounds risky but thats what counts.  However I would also say that a number of other financial products available fall into this category. Just because Ive no interest does not mean there is no market  and I recognize that there is a market for it. I can envision a future in which LNstyle transacting is the norm and in that future I can see myself tying up funds in channels to facilitate commerce.  However that future is very detached from the actual present  the road from here to there is paved with questionable materials. The puzzle of decentralized routing has yet to be solved despite  years of effort toward it across multiple applications  until a serious coherent solution to this problem is presented the Lightning Network cannot be realized. Much like Satoshis solution of the Byzantine Generals Problem yielded the existence of Bitcoin  a solution to the Decentralized Routing Problem would yield the existence of hubless payment channel networks Lightning.,2016-12-09T16:20:59.000Z,0.0
1294518,-5.0,1,gtThe two are similar but different as clearly stated in the white paper  The white paper clearly says they are similar not different.  And I think the only difference is the precision of difficulty and the fact that difficulty adjusts.  Hashcash required finding a SHA hash that began with a certain number of zeros i.e. a hash lt ... while Bitcoins POW is exactly like hashcash but with a more exacting difficulty e.g. a SHA hash lt af....  Do you know of any other differences?,2016-12-29T12:02:54.000Z,0.25
1294519,30.0,0,Accidentally stumbled upon that thread through rall and its a gold mine  year olds getting lured into Bitcoin.   How do you do fellow millenials? Dont trust these evil incompetent banks? Well heres help have you ever heard of Bitcoin? Because I need to cash out of it its the currency of the future!!!  If my bank told me they were storing my deposits in a ditch under a highway bridge where the bums meet theyd probably still do it more professionally than the Butters running your online wallet.,2016-12-01T13:00:17.000Z,0.25
1294520,36.0,0,I still cant wrap my head around this currency. Can someone try to explain?  Like do I buy a bitcoin with cash?,2016-12-25T12:54:59.000Z,0.25
1294521,56.0,0,You know one of the things that I found during my time in Kenya is that many Kenyans find it insulting how so many westerners assume that all Kenyans are subsistence level poor or that the only problems worth solving are for the poorest in the area. Theres a lot of Kenyans whose incomes  or their businesses incomes  are comparable to those in western countries yet could still benefit greatly from the easier capital movement that Bitcoin provides. Equally those same people could benefit greatly from true scaling solutions like Lightning... but thats no different than anywhere else in the world.  I was on two panels while I was there and one of the points I made during that was we shouldnt start by assuming everything in Africa is totally unlike western countries and the problems we face are completely dissimilar. Kenya is still a capitalist democracy with uncensored internet  in fact better mobile internet than I can get at home. They still eat similar food and have similar brands as back home. Sure theres a lot thats different  for instance the amount of private security in Kenya is beyond any other place Ive ever been  but by assuming everything is different biases you to assuming that you cant learn from each other and we certainly can.  Funny enough the only time I ever felt anything Id call culture shock during my time there was when they closed the Bitcoin meetup with a Christian prayer!  edit typo,2016-12-21T15:20:56.000Z,0.25
1294522,19.0,0,Looks like u got the gist of it.  Next step would be to understand why decentralisation is so important for Bitcoin,2016-12-13T00:38:06.000Z,0.25
1294523,51.0,0,Now this is a bad title. A vague tweet from a CEO does not mean it looks like the company will be accepting bitcoin soon.,2016-12-26T19:16:47.000Z,0.25
1294524,25.0,0,People have not yet realized they have the option to escape from banks and governments. As they gradually wake up to that fact the value of bitcoin will rise to levels which are unthinkable today. The service bitcoin provides is priceless. It fulfills a fundamental need for mankind that of being free from racketeering by the rich and powerful elite which controls governments. So I think one should not worry about not having invested earlier.,2016-12-24T09:47:28.000Z,0.5
1294525,46.0,0,The transcription is a bit off here.   I think Roger said  gt... I suppose the reason Im not going to endorse segmit today segwit today is mainly because I feel like the current core team didnt listen At All to the actual business community that was using bitcoin. emphasis added  Not  gt...to my business community using bitcoin emphasis added  paging ukanzure maybe you can verify my correction.,2016-12-15T02:47:11.000Z,0.25
1294526,21.0,0,Also importantly for HODLers there are only  days since the genesis block  days ago that you could have bought bitcoin for more.,2016-12-12T15:15:25.000Z,0.25
1294527,23.0,0,Im really disappointed by this news Im in the UK and Circle was the fastest easiest and  cheapest way I found to buy bitcoin. I really dont fancy going back to localbitcoins or anywhere else where I have to set up a bank transfer to some random person every time I trade.,2016-12-07T05:49:18.000Z,0.25
1294528,17.0,0,WTF is this shit? gt Hashcash is a proofofwork system used to limit email spam and denialofservice attacks and more recently has become known for its use in bitcoin and other cryptocurrencies as part of the mining algorithm. Hashcash was proposed in March  by Adam Back.  and  gt Bitcoin makes a minor adjustment to Hashcash to support more precise work in fractions of a bit the original hashcash specification for simplicity limits work adjustment to whole powers of .   here.,2016-12-29T16:40:34.000Z,0.25
1294529,17.0,0,gt You can be banned for this.  Yet you never care about anyone posting my email address or the previous posts of gavins.  .. you threaten to ban me for posting a link to the same information thats on the Bitcoin Unlimited and Bitcoin Classic sites youre constantly pumping.  I feel sad that your paid disinformation job is conflicting with your cowardly fear of banning me but its your problem not mine.  gt  as we had to add a special automod configuration because you were trying to dox someone  Gee you never complained to me about that. But thanks for confirming that you had a secret automoderator rule hiding my posts.  I had reverse engineered it from getting hidden instantly already. But when I told people that rbtc mods were abusing automod to secretly hide posts you vigorously denied it.,2016-12-02T18:24:10.000Z,0.25
1294530,18.0,0,Which just belies his true motivation to cripple Bitcoin. He doesnt care about all his fellow core devs who spent many hours coding it up nor the countless man hours of the rest of the community who prepared for what was supposed to be a slam dunk. With the help of several censored forums of theymos.,2016-12-03T15:56:58.000Z,0.25
1294531,17.0,0,gt attempt to negotiate a new agreement with Bitcoin Core to implement SW as a hard fork with a corresponding block size increase  What do we owe Core devs exactly? They failed us in every possible way. They deserve nothing less than to be destroyed by the competition at this point. Why are we still so compelled to be nice to them? This isnt gradeschool.   gt or switch to implementations which support this with marketdriven capacity increases.  This is the right answer. Renegotiate? How about run a different client built by people who actually care.,2016-12-21T20:22:39.000Z,0.25
1294532,16.0,0,Exited my positions at . Going to bed and got some stops and limits set overnight. A very successful day today. Walked away with a  profit  Im going to take a break from Bitcoin and trading in general after this weekend. Ive caught myself with my mind ALWAYS thinking about Bitcoin and Stock trading. Letting money consume everything I do is starting to be bad for my health and my relationship.   Dont get obsessed guys. Money cant buy you everything. Happy trading!,2016-12-02T06:30:30.000Z,0.5
1294533,-6.0,0,we all must give credits to bitcoin core devs for their amazing job all of this years.,2016-12-28T23:03:25.000Z,0.75
1294534,23.0,0,From BIP usual.,2016-12-18T15:27:27.000Z,0.5
1294535,24.0,0,Nobody does treat him like a prophet. He designed something that people jumped in for believing in it and started using it. Now there are attackers changing what Satoshi created completely. Thats why Satoshi is quoted a lot and that is why those attackers often lie censor and manipulate truth about Satoshi and the original bitcoin.   If it was not an attack those socalled Core developers would just move on to create an alt coin instead of making an alt coin out of bitcoin.,2016-12-22T17:08:17.000Z,0.25
1294536,51.0,0,Is that your job going around and checking and mentioning everyones account age after your lackeys utheymos and ubashco ban their prior accounts?  Clearly you arent a CTO of anything other than systematically attempting to control and destroy Bitcoin so Ive been wondering what it is you do all day.,2016-12-30T01:58:08.000Z,0.25
1294537,20.0,0,I was just talking about this to a friend I was shocked at first thinking they didnt accept bitcoin! Also archive.org as mentioned above accepts bitcoin donations they also pay their employees partly in bitcoin and the owner convinced the sushi place aroun the corner to accept it. I went by once and the owner just had a ipad with his blockchain url and we converted the price from my wallet he told me he was saving them for the future and he had a about  coins this was about  years ago.,2016-12-07T15:34:21.000Z,0.25
1294538,25.0,0,Get  credit cards and buy Bitcoin with them.,2016-12-07T01:43:03.000Z,0.25
1294539,-32.0,0,I am an ETC supporter and I think Consensys and its founder Lubin have no future in this space. For me Consensys the EF and theDAO are inextricably linked in terms of special interest groups. The future of Ethereum is bigger than any of them bigger than Vitalik just as Bitcoin is bigger than Satoshi.  I do not wish to be accused of hate mongering for I have no particular emotion in this matter. It is simply what makes sense to me and I do not mean to diminish the work done by the aforementioned groups. After all we wouldnt be here without them.  gt Herein lies  decentralized technology predictions  Prediction  ETC to overtake ETH for very simple reasons. No religious dogma required.  gt The key question asked will be How much should we pay to trust each other?  Nothing  gt  was mostly the year of the blockchain ProofofConcept PoC  No it was the year of TheDAO a disastrous smart contract nonPoC   gt Nonproofofwork consensus algorithms will be the new black  Within  months? You wish.   gt Regulatory bodies will interact with first class blockchain citizens like Coinbase Coin Center ConsenSys and Union Square Venture  Ah and there I had to stop reading. Rate yourselves much?,2016-12-23T18:47:01.000Z,0.25
1294540,30.0,0,I know a guy who did this. He was in his s no kids and a wife who was leaving him for another man. He just said fuck it. Over a few months he got a bunch more credit cards and worked to get the highest limits he could. Then one day he maxed them all out buying gold and other things he could turn into cash. Turned the cash into bitcoin and left for Thailand. Im not sure exactly how he hides the money and doesnt get caught but my guess is that even though its a lot to me its not that much to the banks that they are going to Asia to get him probably takes a while too. Anyways he just lives it up in Thailand instead of being poor and miserable in America for his golden years.,2016-12-05T06:16:19.000Z,0.25
1294541,14.0,0,The monetary system has failed us. Please investigate a resource based economy. Also check out Bitcoin and rbtc.,2016-12-01T06:03:12.000Z,0.25
1294542,21.0,0,Our Bitcoin who art in code  Hallowed be thy blockchain  Thy riches shall come if we add the sum  Of all coins on exchanges and in cold storage  Give us this day our daily green candles   And forgive those who short against us  Thy moon shall come thy bubbles run  On earth as it is in heaven   Amen,2016-12-25T06:37:26.000Z,0.25
1294543,45.0,0,And whats good for leftism is good for bitcoin.,2016-12-16T19:42:08.000Z,0.75
1294544,22.0,0,And what was all that debate and conflict the  years before SegWit? Inconvenient history?  Ver joined a group who were ideologically opposed to you. He did not make the debate. He joined in  years later because you used the centralized influence of core to leverage your own politics into Bitcoin and didnt give a shit what users miners and hodlers thought.,2016-12-24T03:07:32.000Z,0.25
1294545,-6.0,0,until LN is ready for going beyond testnet its not needed anyway so pools are adopting slow.  but this retard thread will tell you its bad blockstream and good people who want to see forking bitcoin because they are holding ETH.,2016-12-14T23:06:16.000Z,0.25
